{
  "status": "SUCCESS",
  "model_provenance": {
    "architecture": "TinySalNet (96,521 parameters)",
    "training_supervision": "DHF1K continuous saliency-density supervision",
    "model_hash": "fd6f27fd5ef6334c597ee3981086fc70f639cd59c7d57399fa72253d883b95c9",
    "execution_device": "CPU"
  },
  "sampling_metadata": {
    "sampling_rule": "Deterministic ~1 fps capped at budget",
    "video_fps": 30.0,
    "total_video_frames": 826,
    "sampled_frame_count": 20,
    "frame_indices": [
      0,
      30,
      60,
      120,
      150,
      210,
      240,
      270,
      330,
      360,
      420,
      450,
      510,
      540,
      570,
      630,
      660,
      720,
      750,
      810
    ],
    "timestamps_sec": [
      0.0,
      1.0,
      2.0,
      4.0,
      5.0,
      7.0,
      8.0,
      9.0,
      11.0,
      12.0,
      14.0,
      15.0,
      17.0,
      18.0,
      19.0,
      21.0,
      22.0,
      24.0,
      25.0,
      27.0
    ]
  },
  "summary": {
    "mean_spatial_dispersion": 0.23956,
    "mean_spatial_entropy_bits": 12.3429,
    "mean_inter_frame_shift": 0.7305
  },
  "samples": [
    {
      "source_video_path": "htdyr.mp4",
      "frame_idx": 0,
      "timestamp_sec": 0.0,
      "input_width": 160,
      "input_height": 90,
      "model_version": "Phase 7 TinySalNet",
      "model_hash": "fd6f27fd5ef6334c597ee3981086fc70f639cd59c7d57399fa72253d883b95c9",
      "saliency_spatial_dispersion": 0.27746,
      "saliency_spatial_entropy_bits": 12.3043,
      "saliency_centroid_x": 0.4125,
      "saliency_centroid_y": 0.4915,
      "saliency_peak_x": 0.2013,
      "saliency_peak_y": 0.5955,
      "inter_frame_saliency_shift": 0.0,
      "saliency_map_thumbnail": [
        [
          0,
          0,
          0,
          0,
          0,
          0,
          0,
          0,
          0,
          0,
          0,
          0,
          0,
          0,
          0,
          0,
          0,
          0,
          0,
          0,
          0,
          0,
          0,
          0,
          0,
          0,
          0,
          0,
          0,
          0,
          0,
          0
        ],
        [
          0,
          0,
          0,
          0,
          0,
          0,
          0,
          0,
          0,
          0,
          0,
          0,
          0,
          0,
          0,
          0,
          0,
          0,
          0,
          0,
          0,
          0,
          0,
          0,
          0,
          0,
          0,
          0,
          0,
          0,
          0,
          0
        ],
        [
          0,
          0,
          0,
          0,
          0,
          0,
          0,
          0,
          0,
          0,
          0,
          0,
          0,
          0,
          0,
          0,
          0,
          0,
          0,
          0,
          0,
          0,
          0,
          0,
          0,
          0,
          0,
          0,
          0,
          0,
          0,
          0
        ],
        [
          0,
          0,
          0,
          0,
          0,
          0,
          0,
          0,
          0,
          0,
          0,
          0,
          0,
          0,
          0,
          0,
          0,
          0,
          0,
          0,
          0,
          0,
          0,
          0,
          0,
          0,
          0,
          0,
          0,
          0,
          0,
          0
        ],
        [
          0,
          0,
          0,
          0,
          0,
          0,
          0,
          0,
          0,
          0,
          0,
          0,
          0,
          0,
          0,
          0,
          0,
          0,
          0,
          0,
          0,
          0,
          0,
          0,
          0,
          0,
          0,
          0,
          0,
          0,
          0,
          0
        ],
        [
          0,
          0,
          0,
          0,
          0,
          0,
          0,
          0,
          0,
          0,
          0,
          0,
          0,
          0,
          0,
          0,
          0,
          0,
          0,
          0,
          0,
          0,
          0,
          0,
          0,
          0,
          0,
          0,
          0,
          0,
          0,
          0
        ],
        [
          0,
          0,
          0,
          0,
          0,
          0,
          0,
          0,
          0,
          0,
          0,
          0,
          0,
          0,
          0,
          0,
          0,
          0,
          0,
          0,
          0,
          0,
          0,
          0,
          0,
          0,
          0,
          0,
          0,
          0,
          0,
          0
        ],
        [
          0,
          0,
          0,
          0,
          0,
          0,
          0,
          0,
          0,
          0,
          0,
          0,
          0,
          0,
          0,
          0,
          0,
          0,
          0,
          0,
          0,
          0,
          0,
          0,
          0,
          0,
          0,
          0,
          0,
          0,
          0,
          0
        ],
        [
          0,
          0,
          0,
          0,
          0,
          0,
          0,
          0,
          0,
          0,
          0,
          0,
          0,
          0,
          0,
          0,
          0,
          0,
          0,
          0,
          0,
          0,
          0,
          0,
          0,
          0,
          0,
          0,
          0,
          0,
          0,
          0
        ],
        [
          0,
          0,
          0,
          0,
          0,
          0,
          0,
          0,
          0,
          0,
          0,
          0,
          0,
          0,
          0,
          0,
          0,
          0,
          0,
          0,
          0,
          0,
          0,
          0,
          0,
          0,
          0,
          0,
          0,
          0,
          0,
          0
        ],
        [
          0,
          0,
          0,
          0,
          0,
          0,
          0,
          0,
          0,
          0,
          0,
          0,
          0,
          0,
          0,
          0,
          0,
          0,
          0,
          0,
          0,
          0,
          0,
          0,
          0,
          0,
          0,
          0,
          0,
          0,
          0,
          0
        ],
        [
          0,
          0,
          0,
          0,
          0,
          0,
          0,
          0,
          0,
          0,
          0,
          0,
          0,
          0,
          0,
          0,
          0,
          0,
          0,
          0,
          0,
          0,
          0,
          0,
          0,
          0,
          0,
          0,
          0,
          0,
          0,
          0
        ],
        [
          0,
          0,
          0,
          0,
          0,
          0,
          0,
          0,
          0,
          0,
          0,
          0,
          0,
          0,
          0,
          0,
          0,
          0,
          0,
          0,
          0,
          0,
          0,
          0,
          0,
          0,
          0,
          0,
          0,
          0,
          0,
          0
        ],
        [
          0,
          0,
          0,
          0,
          0,
          0,
          0,
          0,
          0,
          0,
          0,
          0,
          0,
          0,
          0,
          0,
          0,
          0,
          0,
          0,
          0,
          0,
          0,
          0,
          0,
          0,
          0,
          0,
          0,
          0,
          0,
          0
        ],
        [
          0,
          0,
          0,
          0,
          0,
          0,
          0,
          0,
          0,
          0,
          0,
          0,
          0,
          0,
          0,
          0,
          0,
          0,
          0,
          0,
          0,
          0,
          0,
          0,
          0,
          0,
          0,
          0,
          0,
          0,
          0,
          0
        ],
        [
          0,
          0,
          0,
          0,
          0,
          0,
          0,
          0,
          0,
          0,
          0,
          0,
          0,
          0,
          0,
          0,
          0,
          0,
          0,
          0,
          0,
          0,
          0,
          0,
          0,
          0,
          0,
          0,
          0,
          0,
          0,
          0
        ],
        [
          0,
          0,
          0,
          0,
          0,
          0,
          0,
          0,
          0,
          0,
          0,
          0,
          0,
          0,
          0,
          0,
          0,
          0,
          0,
          0,
          0,
          0,
          0,
          0,
          0,
          0,
          0,
          0,
          0,
          0,
          0,
          0
        ],
        [
          0,
          0,
          0,
          0,
          0,
          0,
          0,
          0,
          0,
          0,
          0,
          0,
          0,
          0,
          0,
          0,
          0,
          0,
          0,
          0,
          0,
          0,
          0,
          0,
          0,
          0,
          0,
          0,
          0,
          0,
          0,
          0
        ]
      ]
    },
    {
      "source_video_path": "htdyr.mp4",
      "frame_idx": 30,
      "timestamp_sec": 1.0,
      "input_width": 160,
      "input_height": 90,
      "model_version": "Phase 7 TinySalNet",
      "model_hash": "fd6f27fd5ef6334c597ee3981086fc70f639cd59c7d57399fa72253d883b95c9",
      "saliency_spatial_dispersion": 0.22524,
      "saliency_spatial_entropy_bits": 12.0394,